gap,status,resolved_now,current_evidence,required_to_close,can_include_in_main_benchmark
CFM-ID complete CASMI native ranking,incomplete_full_supported,False,"cfmid4-compatible native binary smoke passed; the original direct full-run manifest covers 170 supported [M+H]+/[M-H]- CASMI queries, 1062950 candidate rows, and 34 shards. A faster precomputed-spectrum pipeline is now prepared for 170 supported queries, 1062950 candidate rows, and 936483 unique candidate spectra; currently cached spectra=10 and completed supported queries=0. A separate complete-query subset is available with 2 selected queries using their full candidate sets; subset MRR=0.11612903225806452. Expansion query 35 status=completed_ranked with 233/233 predicted spectra, ranked_rows=233, true_rank=31. Unsupported adduct counts: {'[M+Na]+': 59}.","execute all CFM-ID precomputed candidate-spectrum shards, then all query-ranking shards, and obtain complete per-query CFM-ID candidate score tables for every supported query; add an [M+Na]+ model or report those CASMI rows as unsupported",False
MS2DeepScore reasonable CASMI candidate-ranking benchmark,partial_complete_query_hybrid_subset_available_full_casmi_blocked,False,"official dual-mode MS2DeepScore model cache recorded outside Git; CPU environment verified with MS2DeepScore 2.7.2, MatchMS 0.33.1, Torch 2.4.1+cpu; required model files present=True. A candidate-limited CFM-ID + MS2DeepScore hybrid subset exists. A complete-query CFM-ID + MS2DeepScore hybrid subset is also available for selected full-candidate queries with n_queries=2, candidate policy=full_candidate_set_for_each_selected_query, Top-5=0.5, MRR=0.10704225352112677. Full CASMI candidate ranking still lacks a complete per-candidate spectrum library.",construct a complete CASMI per-candidate measured or generated spectrum library and run a documented MS2DeepScore query-candidate scoring wrapper; label generator+MS2DeepScore reranking as hybrid rather than native MS2DeepScore,False
trained neural FragAnnotor CASMI effective result,completed_report_only_weak,True,"frozen checkpoint Top-1=0.0087336244541484, Top-10=0.0262008733624454, MRR=0.0172596075877486","for an effective neural claim, train/select on non-CASMI data with explicit CASMI structure exclusion and improve beyond fixed component-score mode without CASMI tuning",False
CASMI pairwise rank delta outliers,fixed,True,"sota_pairwise_rank_comparison.csv now reports n_completed_queries, n_rank_valid_queries, and n_missing_rank_pairs; max_abs_reported_rank_delta=69.28125; has_sentinel_scale_rank_delta=False",none for the current artifact; continue excluding unavailable or non-finite rank pairs from paired deltas,True
strong SOTA claim,blocked_pending_harmonized_direct_comparison,False,"ICEBERG/MassFormer/NEIMS are available only as imported public/vendor context, not harmonized candidate-level reruns","run FragAnnotor, CFM-ID, SIRIUS/CSI, ICEBERG, MassFormer, NEIMS, and MS2DeepScore on the same CASMI candidate set, preprocessing, split, adduct assumptions, and metrics",False
