model,native_available,executable_or_package,version,blocker,subset_status
CFM-ID,False,/home/zhome/ec_structure/external_ms_models/vendor/cfm-id-code/cfm/build_local_py36/bin/cfm-id,native_binary_smoke_passed_runtime_blocked,"CFM-ID 4.x-compatible native binary was found and smoke-tested, but CASMI full candidate ranking remains runtime-blocked: a 100-candidate timing run did not finish within 15 minutes, so no full native CASMI CFM-ID score table is reported.",
SIRIUS,True,,SIRIUS 4.9.15 native formula result file,,
MS2DeepScore,False,,unavailable,MS2DeepScore is a spectrum-to-spectrum similarity model; this CASMI candidate-ranking benchmark has candidate structures but no complete per-candidate reference/predicted spectrum library or configured pretrained MS2DeepScore model. No native MS2DeepScore candidate-ranking scores are reported.,
CFM-ID,False,/home/zhome/ec_structure/external_ms_models/vendor/cfm-id-code/cfm/build_local_py36/bin/cfm-id,passed,"Do not report native CFM-ID CASMI Top-k metrics until a complete per-query candidate score table is generated. Smoke/partial outputs are readiness evidence only, not benchmark results.",completed_candidate_limited_subset
MS2DeepScore,False,ms2deepscore/matchms package install attempted in user-space venv,,"Do not report MS2DeepScore CASMI Top-k metrics. MS2DeepScore scores spectrum pairs; the CASMI structure-candidate benchmark lacks a complete per-candidate measured or predicted spectrum library and no configured pretrained MS2DeepScore model file is present. CFM-ID predicted spectra were not substituted, because that would be a hybrid CFM-ID plus MS2DeepScore baseline rather than native MS2DeepScore.",blocked_no_pretrained_model_or_complete_candidate_spectrum_library
